{
  "schema_version": 2,
  "outcome_id": "OUT-PSD-001",
  "title": "Пиксельная игра космический уклон для пилота PDE",
  "outcome_state": "ready",
  "pack_status": "baseline",
  "pack_type": "mini",
  "version": "1.1.0",
  "risk_level": "R1",
  "autonomy_level": "A1",
  "owners": {
    "outcome_owner": "PDE Owner",
    "pde_owner": "PDE Owner",
    "risk_owner": "PDE Owner"
  },
  "problem": {
    "summary": "Без маленького запускаемого приложения пилот PDE ASE QSRE не проверяет handoff evidence и обратную связь на реальном продукте.",
    "evidence_links": [
      "workspaces/projects/pixel-space-dodger/task-brief.md"
    ]
  },
  "outcome": {
    "statement": "Доступна играбельная чёрно-белая пиксельная аркада в отдельном окне с меню автострельбой энтропией очками шкалой из пяти сердечек узнаваемым кораблём спавном врагов за краем и локальными рекордами."
  },
  "scope": {
    "in": [
      "JavaScript-приложение в отдельном окне",
      "меню Новая игра Рекорды Выход и экран завершения партии",
      "автострельба уклон астероиды рост сложности очки и клавиатура без мыши",
      "чёрно-белая пиксельная графика движущиеся звёзды и вариации астероидов",
      "локальные рекорды таблица до пяти результатов",
      "README или стартовый экран с запуском и управлением",
      "шкала из пяти чёрно-белых сердечек и короткая неуязвимость после удара",
      "узнаваемый силуэт корабля и появление врагов за краем поля минимум двумя шаблонами"
    ],
    "out": [
      "звук в первом срезе",
      "цветная или трёхмерная графика",
      "онлайн-мультиплеер и облачные рекорды",
      "магазины публикация Steam аккаунты",
      "жёсткая фиксация структуры репозитория продукта"
    ]
  },
  "acceptance_criteria": [
    {"id": "AC-001", "statement": "При запуске открывается отдельное окно с меню Новая игра Рекорды и Выход"},
    {"id": "AC-002", "statement": "В партии виден счётчик очков и уничтожение астероида выстрелом увеличивает счёт"},
    {"id": "AC-003", "statement": "Корабль стреляет автоматически без ручного выстрела"},
    {"id": "AC-004", "statement": "За одну партию заметно растут скорость или число астероидов"},
    {"id": "AC-005", "statement": "Столкновение с астероидом снимает одно сердечко и не завершает партию пока остаются жизни"},
    {"id": "AC-006", "statement": "Экран Рекорды показывает сохранённый лучший результат после партии"},
    {"id": "AC-007", "statement": "Корабль астероид выстрел и звёзды различимы в чёрно-белой пиксельной стилистике"},
    {"id": "AC-008", "statement": "Управление кораблём выполняется стрелками клавиатуры или равнозначными клавишами"},
    {"id": "AC-009", "statement": "После завершения партии показывается экран Game Over с запуском новой игры"},
    {"id": "AC-010", "statement": "Во время партии на экране отображается текущий счёт"},
    {"id": "AC-011", "statement": "При старте новой игры счёт сбрасывается в ноль"},
    {"id": "AC-012", "statement": "Позиция и скорость астероидов псевдослучайны чтобы партии не повторялись"},
    {"id": "AC-013", "statement": "Размеры и форма астероидов имеют несколько пиксельных вариаций"},
    {"id": "AC-014", "statement": "Фон только чёрный а элементы только белые или серые без цветных объектов"},
    {"id": "AC-015", "statement": "Движение звёзд фона даёт эффект полёта через параллакс или прокрутку"},
    {"id": "AC-016", "statement": "В окне меню отображается название игры"},
    {"id": "AC-017", "statement": "Раздел Рекорды показывает таблицу лучших результатов до пяти записей"},
    {"id": "AC-018", "statement": "Рекорды сохраняются локально после закрытия и повторного запуска приложения"},
    {"id": "AC-019", "statement": "Столкновение выстрела с астероидом уничтожает астероид и увеличивает счёт"},
    {"id": "AC-020", "statement": "Корабль не выходит за пределы игрового окна"},
    {"id": "AC-021", "statement": "Одновременно видимые выстрелы не ограничены либо имеют разумный лимит"},
    {"id": "AC-022", "statement": "Быстрые повторные нажатия клавиш обрабатываются без зависания управления"},
    {"id": "AC-023", "statement": "В README или на стартовом экране есть краткие инструкции по управлению и цели"},
    {"id": "AC-024", "statement": "Все действия доступны с клавиатуры и игра проходима без мыши"},
    {"id": "AC-025", "statement": "Код приложения лежит в отдельной папке или репозитории и готов к передаче"},
    {"id": "AC-026", "statement": "Внешние зависимости отсутствуют либо явно указаны в документации"},
    {"id": "AC-027", "statement": "Для проверки есть простой старт одной командой или двойным кликом"},
    {"id": "AC-028", "statement": "Нет критических ошибок логики корабль не застревает и очки не уходят в минус"},
    {"id": "AC-029", "statement": "Графика читается на разрешении от восьмисот на шестьсот пикселей и выше"},
    {"id": "AC-030", "statement": "На месте обязательные элементы интерфейса счёт шкала из пяти сердечек меню рекорды выход и перезапуск"},
    {"id": "AC-031", "statement": "Во время партии на экране видна шкала из пяти пиксельных сердечек"},
    {"id": "AC-032", "statement": "При старте новой игры шкала жизней восстанавливается до пяти заполненных сердечек"},
    {"id": "AC-033", "statement": "После потери сердечка корабль получает короткую неуязвимость чтобы одно столкновение не сняло все жизни"},
    {"id": "AC-034", "statement": "Заполненное и пустое сердечко различимы в чёрно-белой палитре без красного цвета"},
    {"id": "AC-035", "statement": "Корабль имеет узнаваемый пиксельный силуэт с носом корпусом и зоной двигателей"},
    {"id": "AC-036", "statement": "Враги появляются за краем игрового поля и только затем въезжают в видимую зону"},
    {"id": "AC-037", "statement": "Есть минимум два различных шаблона появления врагов"},
    {"id": "AC-038", "statement": "Экран Game Over показывается только после потери последнего сердечка"}
  ],
  "nfrs": [
    {"id": "NFR-001", "statement": "Запуск описан одной понятной командой или действием в README приложения"},
    {"id": "NFR-002", "statement": "Игровая графика первого среза использует только чёрный белый и оттенки серого"}
  ],
  "open_questions": [
    {
      "id": "Q-001",
      "question": "Какое имя внешнего репозитория продукта выберет ASE если код не в каталоге Outcome",
      "blocking": false,
      "owner": "ASE",
      "status": "open"
    },
    {
      "id": "Q-002",
      "question": "Проведён ли Ready Review владельцем до формальной передачи результата в ASE",
      "blocking": true,
      "owner": "PDE Owner",
      "status": "resolved"
    }
  ],
  "measurement": {
    "metric": "доля выполненных критериев приёмки AC-001…AC-038",
    "baseline": "срез Pack 1.0.0 без шкалы жизней усиленного силуэта и спавна за краем",
    "target": "38 из 38 AC и оба NFR первого среза",
    "source": "ручной чеклист и скриншоты партии",
    "validation_window": "один рабочий день после передачи реализации",
    "decision_rule": "keep если все AC и NFR пройдены иначе adapt или revert"
  },
  "telemetry": {
    "signals": [
      {
        "name": "число пройденных AC",
        "source": "чеклист проверяющего",
        "decision_use": "поддерживает решение keep adapt или revert"
      },
      {
        "name": "рекорд после перезапуска",
        "source": "экран Рекорды",
        "decision_use": "подтверждает выполнение локального рекорда AC-018"
      },
      {
        "name": "оставшиеся сердечки до Game Over",
        "source": "шкала жизней в партии",
        "decision_use": "подтверждает что партия не заканчивается с первого столкновения"
      }
    ],
    "observation_window": "один рабочий день после передачи реализации"
  },
  "test_plan": {
    "strategy": "Ручной чеклист по каждому AC и NFR плюс повторный запуск для рекорда и проверка жизней силуэта и спавна",
    "environments": ["машина разработчика ASE", "машина проверяющего"],
    "requirement_coverage": [
      "AC-001", "AC-002", "AC-003", "AC-004", "AC-005", "AC-006", "AC-007",
      "AC-008", "AC-009", "AC-010", "AC-011", "AC-012", "AC-013", "AC-014",
      "AC-015", "AC-016", "AC-017", "AC-018", "AC-019", "AC-020", "AC-021",
      "AC-022", "AC-023", "AC-024", "AC-025", "AC-026", "AC-027", "AC-028",
      "AC-029", "AC-030", "AC-031", "AC-032", "AC-033", "AC-034", "AC-035",
      "AC-036", "AC-037", "AC-038", "NFR-001", "NFR-002"
    ]
  },
  "release": {
    "rollout": [
      "Локальный запуск проверяющим по README на одной машине"
    ],
    "stop_conditions": [
      "Не открывается отдельное окно или любой AC не выполняется после заявленной готовности",
      "Партия заканчивается с первого столкновения либо нет шкалы из пяти сердечек"
    ],
    "rollback": [
      "Вернуться к предыдущему commit приложения или прекратить использование сборки"
    ]
  },
  "redmine": {
    "issue_id": "LOCAL-PSD-001",
    "url": "local://no-redmine/pixel-space-dodger"
  }
}
