{
  "schema_version": 2,
  "outcome_id": "OUT-FIX-001",
  "title": "Алерт устойчивого офлайна контроллера двери",
  "outcome_state": "defined",
  "pack_status": "draft",
  "pack_type": "mini",
  "version": "0.1.0",
  "risk_level": "R1",
  "autonomy_level": "A1",
  "owners": {
    "outcome_owner": "Владелец результата фикстуры",
    "pde_owner": "Владелец PDE фикстуры",
    "risk_owner": "Владелец риска фикстуры"
  },
  "problem": {
    "summary": "Дежурный оператор не видит устойчивый офлайн контроллера двери вовремя и узнаёт о сбое после жалобы арендатора.",
    "evidence_links": [
      "integrations/openspec/fixtures/sample-project/inputs/brd.md"
    ]
  },
  "outcome": {
    "statement": "На рабочем месте дежурного появляется алерт не позже двух минут устойчивого офлайна с идентификатором устройства и временем последнего контакта."
  },
  "scope": {
    "in": [
      "Детекция устойчивого офлайна контроллера двери",
      "Алерт дежурному с идентификатором устройства и временем последнего контакта"
    ],
    "out": [
      "Цветные дашборды и SMS-рассылка",
      "Изменение прошивки контроллера"
    ]
  },
  "acceptance_criteria": [
    {"id": "AC-001", "statement": "Дежурный видит алерт, если контроллер остаётся офлайн дольше двух минут"},
    {"id": "AC-002", "statement": "Алерт содержит идентификатор устройства и время последнего успешного контакта"}
  ],
  "nfrs": [
    {"id": "NFR-001", "statement": "Повторная проверка того же устойчивого офлайна не создаёт дублирующий алерт"}
  ],
  "open_questions": [
    {
      "id": "Q-001",
      "question": "Подтвердить порог устойчивого офлайна в две минуты как рабочий baseline",
      "blocking": true,
      "owner": "Владелец результата фикстуры",
      "status": "open"
    }
  ],
  "measurement": {
    "metric": "Доля устойчивых офлайнов с алертом за две минуты",
    "baseline": "Алерты по устойчивому офлайну отсутствуют",
    "target": "Все устойчивые офлайны фикстуры получают алерт",
    "source": "Журнал алертов дежурного контура",
    "validation_window": "Один рабочий день после передачи",
    "decision_rule": "keep если оба AC и NFR-001 выполнены иначе adapt"
  },
  "release": {
    "rollout": ["Включить алерт только на тестовом контуре дежурного"],
    "stop_conditions": ["Дубли алертов или пропуск устойчивого офлайна"],
    "rollback": ["Выключить публикацию алерта и вернуть журнал без отдельного сигнала"]
  },
  "redmine": {
    "issue_id": "LOCAL-FIX-001",
    "url": "local://no-redmine/openspec-fixture"
  }
}
