{
  "schema_version": 2,
  "outcome_id": "OUT-DEMO-001",
  "title": "Оповещение операторов здания о потере связи с устройством",
  "outcome_state": "done",
  "pack_status": "baseline",
  "pack_type": "full",
  "version": "1.1.0",
  "risk_level": "R2",
  "autonomy_level": "A2",
  "owners": {
    "outcome_owner": "Демонстрационный владелец продукта",
    "pde_owner": "Демонстрационный PDE",
    "risk_owner": "Демонстрационный владелец эксплуатации"
  },
  "problem": {
    "summary": "Операторы демонстрационного бизнес-центра замечают потерю связи с контроллерами в среднем через 14 минут после факта.",
    "evidence_links": ["demo://support-dataset/30-days"]
  },
  "outcome": {
    "statement": "Сократить p95 времени обнаружения потери связи до 120 секунд."
  },
  "scope": {
    "in": ["контроль периодических сигналов устройства", "оповещение о потере связи", "восстановление статуса", "запись аудита"],
    "out": ["автоматическое управление оборудованием", "уведомления конечным жильцам", "изменение встроенного программного обеспечения"]
  },
  "acceptance_criteria": [
    {"id": "AC-001", "statement": "система создаёт оповещение о потере связи не позднее 90 секунд после пропуска допустимого окна контрольных сигналов"},
    {"id": "AC-002", "statement": "после восстановления связи оповещение закрывается, а время потери и восстановления связи сохраняется в журнале аудита"}
  ],
  "nfrs": [
    {"id": "NFR-001", "statement": "доля ложных срабатываний на пилотной площадке ниже 2% за 14 дней"},
    {"id": "NFR-002", "statement": "обработка контрольных сигналов не увеличивает среднюю загрузку контроллера более чем на 3%"}
  ],
  "open_questions": [],
  "measurement": {
    "metric": "p95 времени обнаружения потери связи",
    "baseline": "14 минут",
    "target": "120 секунд",
    "source": "синтетическая выборка обращений в поддержку за 30 дней",
    "validation_window": "14 дней пилота на одной тестовой площадке",
    "decision_rule": "p95 не выше 120 секунд и доля ложных срабатываний ниже 2%"
  },
  "telemetry": {
    "signals": [
      {
        "name": "p95 времени обнаружения потери связи",
        "source": "демонстрационное хранилище контрольных сигналов и оповещений",
        "decision_use": "подтверждает достижение цели в 120 секунд"
      },
      {
        "name": "доля ложных срабатываний",
        "source": "демонстрационное хранилище оповещений",
        "decision_use": "останавливает развёртывание при достижении 5%"
      }
    ],
    "observation_window": "14 дней пилота на одной тестовой площадке"
  },
  "test_plan": {
    "strategy": "детерминированные, интеграционные, повторные и нагрузочные проверки всех AC/NFR",
    "environments": ["симулятор контроллера", "тестовое хранилище событий", "синтетическая площадка", "лабораторный контроллер"],
    "requirement_coverage": ["AC-001", "AC-002", "NFR-001", "NFR-002"]
  },
  "release": {
    "rollout": ["Пилот на одной тестовой площадке"],
    "stop_conditions": ["доля ложных срабатываний ≥ 5% за 24 часа"],
    "rollback": ["выключить обработчик оповещений"]
  },
  "evidence_bundle": {
    "path": "evidence.md",
    "pack_version": "1.1.0",
    "pack_commit_sha": "aaaaaaaaaaaaaaaaaaaaaaaaaaaaaaaaaaaaaaaa",
    "status": "complete"
  },
  "redmine": {
    "issue_id": "RM-DEMO-101",
    "url": "https://redmine.example.invalid/issues/101"
  }
}
