{
  "schema_version": 2,
  "outcome_id": "OUT-CFG-002",
  "title": "Главная страница конфигуратора Э-1 библиотека комплектов",
  "outcome_state": "defined",
  "pack_status": "draft",
  "pack_type": "full",
  "version": "0.1.0",
  "risk_level": "R2",
  "autonomy_level": "A1",
  "owners": {
    "outcome_owner": "Худоян Анита",
    "pde_owner": "Глазырин Максим",
    "risk_owner": "Худоян Анита"
  },
  "problem": {
    "summary": "После входа в веб-панель контроллера инженер не получает однозначную библиотеку комплектов: точка входа рискует стать KPI-дашбордом, онбордингом или третьим корневым экраном и не сокращает путь до открытия или создания комплекта.",
    "evidence_links": [
      "workspaces/projects/av-control-configurator/inputs/REQ-OS-002-e1-main-page/01-scope-and-outcome.md",
      "workspaces/projects/av-control-configurator/inputs/VIS-CFG-001-visual-prohibitions.md",
      "workspaces/projects/av-control-configurator/openspec/changes/chg-002-e1-main-page/proposal.md",
      "http://172.17.130.153/issues/22416"
    ]
  },
  "outcome": {
    "statement": "Инженер в закрытом контуре за одно действие открывает Э-1 с перечнем комплектов или служебной пустой библиотекой и за одно или два следующих действия открывает комплект в Э-2 либо создаёт черновик с выбором мастер или вручную, без дашборда и без третьего корневого экрана."
  },
  "scope": {
    "in": [
      "Экран Э-1 как единственная точка входа в конфигуратор комплекта",
      "Перечень комплектов хранилища контроллера с именем, датой сохранения и индикаторами сессии и блокировки",
      "Поиск по подстроке имени комплекта без учёта регистра",
      "Открытие комплекта в Э-2 с контекстом BLK-1",
      "Создание черновика на Э-1 с выбором только мастер или вручную и переходом в Э-2",
      "Служебное пустое состояние без маскотов и слоганов",
      "Возврат из Э-2 на Э-1 с правилами несохранённых изменений",
      "Визуал Э-1 по тёмным токенам и запретам поверхности К",
      "Команды импорта и экспорта на Э-1 только как вызов C-PRJ-3 без формата пакета"
    ],
    "out": [
      "Первый запуск контроллера, сеть, время и первый администратор",
      "Шаги мастера после выбора способа и вся нелинейная сборка на Э-2",
      "Статусы ожидается на устройствах",
      "Уборка комплекта и деплой серверной части",
      "Подключение клиентов и штатная эксплуатация помещения",
      "Версионирование комплекта и масштабирование на новый контроллер",
      "Назначение экрана пользователю и поля для кого",
      "Шаблоны готовой комнаты как третий способ на Э-1",
      "Формат пакета импорта и экспорта",
      "Светлая тема и облачный каталог комплектов"
    ]
  },
  "acceptance_criteria": [
    {
      "id": "AC-035",
      "statement": "При открытии раздела конфигуратора комплектов система показывает Э-1, а не дашборд, журнал, настройки сети или иной корневой экран"
    },
    {
      "id": "AC-036",
      "statement": "На Э-1 видны все комплекты хранилища контроллера плотным списком с именем, датой сохранения и индикатором несохранённых изменений сессии"
    },
    {
      "id": "AC-037",
      "statement": "Поле поиска на Э-1 фильтрует перечень по подстроке имени без учёта регистра, очистка поля возвращает полный перечень"
    },
    {
      "id": "AC-038",
      "statement": "Явное действие на строке комплекта открывает Э-2 с тем же комплектом и активным контекстом BLK-1"
    },
    {
      "id": "AC-039",
      "statement": "Действие Создать комплект создаёт черновик с временным именем, предлагает мастер или вручную и открывает Э-2, не записывая именованную строку до сохранения"
    },
    {
      "id": "AC-040",
      "statement": "Пустое хранилище на Э-1 показывает служебный текст что комплектов нет и действие Создать комплект без маскотов и слоганов"
    },
    {
      "id": "AC-041",
      "statement": "Из Э-2 есть возврат на Э-1 с предупреждением о несохранённых изменениях до смены комплекта"
    },
    {
      "id": "AC-042",
      "statement": "При создании комплекта предлагаются только мастер и вручную, без готовой комнаты и без отдельного режима готовое устройство"
    }
  ],
  "nfrs": [
    {
      "id": "NFR-026",
      "statement": "Э-1 рисуется на тёмной базе 17181B и поверхности списка 202226, светлая тема как основная запрещена"
    },
    {
      "id": "NFR-027",
      "statement": "На Э-1 нет KPI-плиток и графиков, при наличии комплектов перечень занимает не менее 60 процентов ширины основного контента"
    },
    {
      "id": "NFR-028",
      "statement": "Строка списка высотой 24 px, кнопка Создать комплект высотой 32 px, на ширине 1440 px видно не менее 8 строк без прокрутки всего хрома"
    },
    {
      "id": "NFR-029",
      "statement": "Пустое состояние называет отсутствие комплектов и действие создания, иллюстрация не требуется"
    },
    {
      "id": "NFR-030",
      "statement": "Плоский акцент 4F8FA6 только у Создать комплект, фокуса поиска и выбранной строки, без градиента, стекла и декоративных теней строк"
    }
  ],
  "open_questions": [
    {
      "id": "Q-001",
      "question": "Прогнать кириллицу RU/EN на именах комплектов и контраст акцента 4F8FA6 на фоне 202226 до приёмки макета Э-1",
      "blocking": true,
      "owner": "Глазырин Максим",
      "status": "open"
    },
    {
      "id": "Q-002",
      "question": "Нужно ли на Э-1 дублировать версию и расхождение с развёрнутым членом сверх колонок MVP имя дата индикатор черновика",
      "blocking": false,
      "owner": "Худоян Анита",
      "status": "open"
    },
    {
      "id": "Q-003",
      "question": "Разрешать ли переименование и удаление комплекта с Э-1 если C-PRJ-3 уже даёт API",
      "blocking": false,
      "owner": "Худоян Анита",
      "status": "open"
    }
  ],
  "measurement": {
    "metric": "Доля успешных входов в конфигуратор, где после одного действия из бокового меню виден Э-1, и доля созданий, где после выбора способа инженер оказывается на Э-2",
    "baseline": "Исходный уровень не измерен числом: прототип и chg-001 задают библиотеку словами, но экран Э-1 не зафиксирован как единственная точка входа с колонками поиском и выбором способа",
    "target": "100 процентов проверенных входов показывают Э-1 без дашборда, 100 процентов проверенных созданий доходят до Э-2 не более чем за два действия после Создать комплект",
    "source": "Ручной протокол на стенде контроллера в задаче 22416: скрин или запись шага, SHA сборки, viewport, наличие или отсутствие комплектов",
    "validation_window": "После стендовой сборки Э-1 до приёмки макета и прогона на лабораторном контроллере закрытого контура",
    "decision_rule": "scale если цель выполнена и нет нарушения VIS-BAN на Э-1; keep если цель выполнена только на эмуляторе; adapt если нет прогона кириллицы или контраста; revert если появился третий корневой экран или KPI-дашборд"
  },
  "telemetry": {
    "signals": [
      {
        "name": "Факт показа Э-1 после выбора пункта конфигуратора",
        "source": "Ручной протокол и локальный журнал вех контроллера без облака",
        "decision_use": "Подтверждает AC-035 и отсутствие дашборда на первом экране"
      },
      {
        "name": "Число действий до Э-2 при создании и при открытии",
        "source": "Наблюдение на стенде, без продуктовой облачной телеметрии",
        "decision_use": "Сверяет цель не более двух действий после Создать комплект и одного действия на строке"
      }
    ],
    "observation_window": "После стендовой сборки Э-1 до приёмки макета и прогона на лабораторном контроллере закрытого контура"
  },
  "test_plan": {
    "strategy": "Прогнать каждый AC-035-042 и NFR-026-030 на макете и на стенде закрытого контура с пустой библиотекой, с несколькими комплектами, с поиском, с созданием обоими способами и с возвратом из Э-2",
    "environments": [
      "макет Э-1 viewport 1440 px",
      "эмулятор контроллера закрытого контура",
      "лабораторный контроллер без внешней сети"
    ],
    "requirement_coverage": [
      "AC-035",
      "AC-036",
      "AC-037",
      "AC-038",
      "AC-039",
      "AC-040",
      "AC-041",
      "AC-042",
      "NFR-026",
      "NFR-027",
      "NFR-028",
      "NFR-029",
      "NFR-030"
    ]
  },
  "release": {
    "rollout": [
      "Сначала макет Э-1, затем эмулятор, затем один лабораторный контроллер, без облачной публикации библиотеки"
    ],
    "stop_conditions": [
      "Первый экран конфигуратора показывает KPI-плитки или графики",
      "Появился третий корневой экран мастера или шаблона комнаты",
      "Список комплектов требует облако или внешние шрифты",
      "Кнопки Создать комплект и выбор способа наезжают друг на друга",
      "Черновик без имени появляется как именованная строка библиотеки"
    ],
    "rollback": [
      "Выключить пункт конфигуратора, ведущий на новую Э-1, и вернуть предыдущий вход в библиотеку из OUT-CFG-001; склад комплектов не уничтожать"
    ]
  },
  "redmine": {
    "issue_id": "22416",
    "url": "http://172.17.130.153/issues/22416"
  }
}
