{
  "schema_version": 2,
  "outcome_id": "OUT-000",
  "title": "Short human-readable title",
  "outcome_state": "new",
  "pack_status": "draft",
  "pack_type": "mini",
  "version": "0.1.0",
  "risk_level": "R1",
  "autonomy_level": "A2",
  "owners": {
    "outcome_owner": "TBD",
    "pde_owner": "TBD",
    "risk_owner": "TBD"
  },
  "problem": {
    "summary": "Describe the verified problem",
    "evidence_links": ["https://example.invalid/evidence"]
  },
  "outcome": {
    "statement": "Describe the measurable change"
  },
  "scope": {
    "in": ["Included behavior"],
    "out": ["Excluded behavior"]
  },
  "acceptance_criteria": [
    {"id": "AC-001", "statement": "Verifiable behavior"}
  ],
  "nfrs": [
    {"id": "NFR-001", "statement": "Verifiable quality constraint"}
  ],
  "open_questions": [],
  "measurement": {
    "metric": "Metric name and unit",
    "baseline": "Baseline with period",
    "target": "Target threshold",
    "source": "System of record",
    "validation_window": "Time window",
    "decision_rule": "scale | keep | adapt | revert rule"
  },
  "telemetry": {
    "signals": [
      {"name": "Outcome signal", "source": "System of record", "decision_use": "Supports the Outcome decision rule"}
    ],
    "observation_window": "Defined observation period"
  },
  "test_plan": {
    "strategy": "Verify every AC and NFR with reproducible evidence",
    "environments": ["test"],
    "requirement_coverage": ["AC-001", "NFR-001"]
  },
  "release": {
    "rollout": ["Controlled rollout step"],
    "stop_conditions": ["Measurable stop condition"],
    "rollback": ["Verified rollback action"]
  },
  "redmine": {
    "issue_id": "RM-000",
    "url": "https://redmine.example.invalid/issues/000"
  }
}
